<?xml version="1.0"?>
<xs:schema xmlns:xs="http://www.w3.org/2001/XMLSchema"
  targetNamespace="inventario"
  xmlns="https://www.ejemplo.com"
  elementFormDefault="qualified">

  <xs:element name="inventario">
    <xs:complexType>
      <xs:sequence>
        <xs:element name="objeto" maxOccurs="unbounded">
          <xs:complexType>
            <xs:sequence>
              <xs:element name="mesa">
                <xs:complexType>
                  <xs:sequence>
                    <xs:element name="tipo" type="xs:string"/>
                    <xs:element name="localizacion" type="xs:string"/>
                  </xs:sequence>
                </xs:complexType>
              </xs:element>
              <xs:element name="ordenador">
                <xs:complexType>
                  <xs:sequence>
                    <xs:element name="procesador">
                      <xs:complexType>
                        <xs:simpleContent>
                          <xs:extension base="xs:string">
                            <xs:attribute name="fabricante" type="xs:string"/>
                          </xs:extension>
                        </xs:simpleContent>
                      </xs:complexType>
                    </xs:element>
                    <xs:element name="memoria">
                      <xs:complexType>
                        <xs:simpleContent>
                          <xs:extension base="xs:string">
                            <xs:attribute name="valor" type="xs:string"/>
                          </xs:extension>
                        </xs:simpleContent>
                      </xs:complexType>
                    </xs:element>
                    <xs:element name="discoduro" type="xs:string"/>
                  </xs:sequence>
               
