<?xml version="1.0" encoding="UTF-8"?>
<inventario xmlns="https://www.ejemplo.com" xmlns:xsi="http://www.w3.org/2001/XMLSchema-instance" xsi:schemaLocation="https://www.ejemplo.com examen_JimenezSantiago_Adrian2.xsd"></inventario>
<inventario>
      <inventario>
        <objeto codigo ="C001">
			<mesa>
			<tipo>Modular</tipo>
			<localizacion>España</localizacion>
			</mesa>
			<ordenador>
			<procesador fabricante ="AMD">Ryzen 6
			</procesador>
			<memoria valor ="MB">516</memoria>
			<discoduro>HDD</discoduro>
			</ordenador>
		</objeto>
</inventario>
